{
  "schema_version": "exitdrill/export/v0.1",
  "drill_id": "synthetic-crm-exit-001",
  "source_system": "Invented CommunityCase CRM",
  "exported_at": "2026-07-22T19:00:00Z",
  "entities": [
    {
      "type": "person",
      "id": "person-002",
      "fields": {
        "display_name": "Replacement Synthetic Person",
        "active": true
      }
    },
    {
      "type": "case",
      "id": "case-001",
      "fields": {
        "status": "open",
        "priority": 2
      }
    }
  ],
  "relationships": [
    {
      "type": "case_subject",
      "from_type": "case",
      "from_id": "case-001",
      "to_type": "person",
      "to_id": "person-002"
    }
  ],
  "attachments": [
    {
      "id": "attachment-001",
      "owner_type": "case",
      "owner_id": "case-001",
      "relative_path": "attachments/intake.txt",
      "content_sha256": "aa98cfa5ecb0ffb53a02b7bf54b6f8227670bc8155c411ad3602ef116339d1c1"
    }
  ],
  "permissions": [
    {
      "principal_id": "worker-001",
      "scope_type": "case",
      "scope_id": "case-001",
      "role": "member"
    }
  ],
  "audit_events": [
    {
      "event_id": "event-002",
      "object_type": "case",
      "object_id": "case-001",
      "action": "exported",
      "occurred_at": "2026-07-22T19:00:00Z"
    }
  ]
}
